{
  "$schema": "https://json-schema.org/draft/2020-12/schema",
  "type": "object",
  "properties": {
    "$schema": {
      "type": "string",
      "description": "Editor hint only; ignored by the loader."
    },
    "id": {
      "type": "string",
      "pattern": "^[a-z0-9]+(?:-[a-z0-9]+)*$",
      "description": "Unique merchant id, e.g. \"briar-glen-general-store\". Stable once shipped."
    },
    "notes": {
      "type": "string",
      "minLength": 1,
      "description": "Who runs it and why these prices and stock, for owner review."
    },
    "npcId": {
      "type": "string",
      "pattern": "^[a-z0-9]+(?:-[a-z0-9]+)*$",
      "description": "The NPC who speaks for the shop (dialogue speaker id)."
    },
    "displayName": {
      "description": "The keeper’s name as the shop window shows it, e.g. \"Ottilie Marsh\"; absent = the NPC id made readable.",
      "type": "string",
      "minLength": 1
    },
    "shopName": {
      "description": "The shop’s name, e.g. \"Brand’s Forge\" (signage, shop window subtitle).",
      "type": "string",
      "minLength": 1
    },
    "personalityTags": {
      "default": [],
      "description": "Personality traits that colour barks and haggling.",
      "type": "array",
      "items": {
        "type": "string",
        "enum": [
          "greedy",
          "gossipy",
          "suspicious",
          "generous",
          "gruff",
          "friendly",
          "shrewd",
          "nervous"
        ]
      }
    },
    "specialties": {
      "default": [],
      "description": "Item categories bought at a better rate (`specialtyBonus`); must be bought categories.",
      "type": "array",
      "items": {
        "type": "string",
        "enum": [
          "weapon",
          "armor",
          "shield",
          "ammo",
          "book",
          "key",
          "consumable",
          "tool",
          "quest",
          "artifact",
          "currency",
          "misc"
        ]
      }
    },
    "buysCategories": {
      "minItems": 1,
      "type": "array",
      "items": {
        "type": "string",
        "enum": [
          "weapon",
          "armor",
          "shield",
          "ammo",
          "book",
          "key",
          "consumable",
          "tool",
          "quest",
          "artifact",
          "currency",
          "misc"
        ]
      },
      "description": "Item categories the merchant buys from the player."
    },
    "stock": {
      "description": "What the merchant sells.",
      "type": "array",
      "items": {
        "type": "object",
        "properties": {
          "item": {
            "description": "An item the merchant stocks.",
            "type": "string",
            "pattern": "^[a-z0-9]+(?:-[a-z0-9]+)*$",
            "x-contentRef": "item"
          },
          "lootTable": {
            "description": "A loot table rolled to stock the shelf (a shop that varies).",
            "type": "string",
            "pattern": "^[a-z0-9]+(?:-[a-z0-9]+)*$",
            "x-contentRef": "loot-table"
          },
          "count": {
            "type": "integer",
            "minimum": 1,
            "maximum": 999,
            "description": "Units of the item, or rolls of the loot table."
          },
          "restock": {
            "description": "How the stock refills; absent = never restocks (a unique good never returns once sold). Runs on world-day ticks: `amount` every `everyHours` rounded up to whole days, up to `count`. A loot-table entry with a rule rotates instead: its unsold units are replaced by `count` fresh rolls each period.",
            "type": "object",
            "properties": {
              "everyHours": {
                "type": "integer",
                "minimum": 1,
                "maximum": 720,
                "description": "In-world hours between restocks."
              },
              "amount": {
                "type": "integer",
                "minimum": 1,
                "maximum": 999,
                "description": "Units (or rolls) added each time, up to `count`."
              }
            },
            "required": [
              "everyHours",
              "amount"
            ],
            "additionalProperties": false
          },
          "when": {
            "description": "A world-fact condition (mw-e27.5): the entry is absent until it holds, appears at the next restock and stays.",
            "$ref": "#/$defs/condition"
          }
        },
        "required": [
          "count"
        ],
        "additionalProperties": false
      }
    },
    "services": {
      "default": [],
      "description": "Services on the shop window’s Services tab (an inn’s rooms).",
      "type": "array",
      "items": {
        "type": "object",
        "properties": {
          "id": {
            "type": "string",
            "pattern": "^[a-z0-9]+(?:-[a-z0-9]+)*$",
            "description": "Service id, unique within the merchant, e.g. \"room-for-the-night\"."
          },
          "name": {
            "type": "string",
            "minLength": 1,
            "description": "What the shop window lists, e.g. \"Room for the night\"."
          },
          "price": {
            "type": "integer",
            "minimum": 1,
            "maximum": 100000,
            "description": "Crowns, fixed by the merchant: no markup, disposition or haggle applies. A `rest` service sits in the inn-bed band 8-15."
          },
          "kind": {
            "type": "string",
            "enum": [
              "rest",
              "train"
            ],
            "description": "`rest`: sleep until morning, fully healed (the Sleeping Ox room). `train`: a lesson that teaches `teaches` (mw-ju8.13)."
          },
          "teaches": {
            "description": "The capability a `train` service teaches; required for `train`, absent otherwise.",
            "type": "string",
            "pattern": "^(verb|spell|arrow|tool|trick|technique|sense)\\.[a-z0-9.-]+$"
          }
        },
        "required": [
          "id",
          "name",
          "price",
          "kind"
        ],
        "additionalProperties": false
      }
    },
    "goldReserve": {
      "type": "integer",
      "minimum": 0,
      "maximum": 9007199254740991,
      "description": "Gold the merchant starts with to pay the player for sales."
    },
    "goldRestockPerDay": {
      "default": 0,
      "description": "Gold the reserve refills by each in-world day, up to `goldReserve`.",
      "type": "integer",
      "minimum": 0,
      "maximum": 9007199254740991
    },
    "markup": {
      "type": "number",
      "exclusiveMinimum": 0,
      "description": "Multiplier on item value when the player buys (economy band 1.1-1.5)."
    },
    "buyRate": {
      "type": "number",
      "exclusiveMinimum": 0,
      "description": "Fraction of item value paid when the player sells (band 0.3-0.6)."
    },
    "specialtyBonus": {
      "description": "Extra multiplier on the buy rate for specialties (band 1.1-1.3); default 1.2.",
      "type": "number",
      "exclusiveMinimum": 0
    },
    "isFence": {
      "default": false,
      "description": "A fence deals in stolen goods.",
      "type": "boolean"
    },
    "buysStolen": {
      "default": false,
      "description": "Buys stolen goods; only a fence (`isFence`) may.",
      "type": "boolean"
    },
    "stolenFactor": {
      "description": "Multiplier on the price of stolen goods (band 0.5-0.8); default 0.6.",
      "type": "number",
      "exclusiveMinimum": 0
    },
    "hours": {
      "description": "Opening hours (world-time hook); absent = always open.",
      "type": "object",
      "properties": {
        "open": {
          "type": "integer",
          "minimum": 0,
          "maximum": 23,
          "description": "Hour of day (0-23) the shop opens."
        },
        "close": {
          "type": "integer",
          "minimum": 0,
          "maximum": 23,
          "description": "Hour of day (0-23) it closes; may be earlier than open (overnight)."
        }
      },
      "required": [
        "open",
        "close"
      ],
      "additionalProperties": false
    },
    "barkSet": {
      "description": "Bark set id for the shopkeeper’s lines (E22).",
      "type": "string",
      "pattern": "^[a-z0-9]+(?:-[a-z0-9]+)*$"
    }
  },
  "required": [
    "id",
    "notes",
    "npcId",
    "buysCategories",
    "goldReserve",
    "markup",
    "buyRate"
  ],
  "additionalProperties": false,
  "$defs": {
    "condition": {
      "description": "A condition over world facts: one of fact, count, all, any, not (docs/design/conditions.md).",
      "anyOf": [
        {
          "type": "object",
          "properties": {
            "fact": {
              "type": "string",
              "pattern": "^(?:entity:[a-z0-9]+(?:-[a-z0-9]+)*\\/[a-z0-9]+(?:-[a-z0-9]+)*\\.)?[a-z0-9]+(?:-[a-z0-9]+)*(?:\\.[a-z0-9]+(?:-[a-z0-9]+)*)*$",
              "description": "Fact key to test. Alone: the (bool) fact is true. With one operator: that comparison holds."
            },
            "eq": {
              "description": "The fact equals this value.",
              "anyOf": [
                {
                  "type": "boolean"
                },
                {
                  "type": "integer",
                  "minimum": -9007199254740991,
                  "maximum": 9007199254740991
                },
                {
                  "type": "string",
                  "minLength": 1
                }
              ]
            },
            "neq": {
              "description": "The fact does not equal this value (unset counts as unequal).",
              "anyOf": [
                {
                  "type": "boolean"
                },
                {
                  "type": "integer",
                  "minimum": -9007199254740991,
                  "maximum": 9007199254740991
                },
                {
                  "type": "string",
                  "minLength": 1
                }
              ]
            },
            "gt": {
              "description": "The (int or tick) fact is greater than this.",
              "type": "integer",
              "minimum": -9007199254740991,
              "maximum": 9007199254740991
            },
            "gte": {
              "description": "The (int or tick) fact is at least this.",
              "type": "integer",
              "minimum": -9007199254740991,
              "maximum": 9007199254740991
            },
            "lt": {
              "description": "The (int or tick) fact is less than this.",
              "type": "integer",
              "minimum": -9007199254740991,
              "maximum": 9007199254740991
            },
            "lte": {
              "description": "The (int or tick) fact is at most this.",
              "type": "integer",
              "minimum": -9007199254740991,
              "maximum": 9007199254740991
            },
            "has": {
              "description": "true: the fact holds a value (set, or declared with a non-null default); false: none.",
              "type": "boolean"
            }
          },
          "required": [
            "fact"
          ],
          "additionalProperties": false,
          "description": "Tests one fact, with at most one operator."
        },
        {
          "type": "object",
          "properties": {
            "count": {
              "type": "string",
              "pattern": "^entity:([a-z0-9]+(?:-[a-z0-9]+)*|\\*)\\/\\*\\.([a-z0-9]+(?:-[a-z0-9]+)*(?:\\.[a-z0-9]+(?:-[a-z0-9]+)*)*)$",
              "description": "Entity facts to count: `entity:<level>/*.<fact>` (one level) or `entity:*/*.<fact>` (every level). Counts those holding true."
            },
            "eq": {
              "description": "The count equals this.",
              "type": "integer",
              "minimum": -9007199254740991,
              "maximum": 9007199254740991
            },
            "neq": {
              "description": "The count does not equal this.",
              "type": "integer",
              "minimum": -9007199254740991,
              "maximum": 9007199254740991
            },
            "gt": {
              "description": "The count is greater than this.",
              "type": "integer",
              "minimum": -9007199254740991,
              "maximum": 9007199254740991
            },
            "gte": {
              "description": "The count is at least this.",
              "type": "integer",
              "minimum": -9007199254740991,
              "maximum": 9007199254740991
            },
            "lt": {
              "description": "The count is less than this.",
              "type": "integer",
              "minimum": -9007199254740991,
              "maximum": 9007199254740991
            },
            "lte": {
              "description": "The count is at most this.",
              "type": "integer",
              "minimum": -9007199254740991,
              "maximum": 9007199254740991
            }
          },
          "required": [
            "count"
          ],
          "additionalProperties": false,
          "description": "Counts true entity facts matching a pattern, compared with exactly one operator."
        },
        {
          "type": "object",
          "properties": {
            "all": {
              "minItems": 1,
              "type": "array",
              "items": {
                "$ref": "#/$defs/condition"
              },
              "description": "Every condition holds."
            }
          },
          "required": [
            "all"
          ],
          "additionalProperties": false,
          "description": "True when every condition in the list holds."
        },
        {
          "type": "object",
          "properties": {
            "any": {
              "minItems": 1,
              "type": "array",
              "items": {
                "$ref": "#/$defs/condition"
              },
              "description": "At least one holds."
            }
          },
          "required": [
            "any"
          ],
          "additionalProperties": false,
          "description": "True when at least one condition in the list holds."
        },
        {
          "type": "object",
          "properties": {
            "not": {
              "description": "The condition that must not hold.",
              "$ref": "#/$defs/condition"
            }
          },
          "required": [
            "not"
          ],
          "additionalProperties": false,
          "description": "True when the condition does not hold."
        }
      ]
    }
  }
}
